"annot_id"	"stratum"	"pmid"	"year"	"journal"	"title"	"abstract"	"doi"	"publication_types"	"mesh_terms"
"A047"	"microbe_ibd"	"40369923"	"2025"	"Zhongguo zhen jiu = Chinese acupuncture & moxibustion"	"[Effects of electroacupuncture at <i>changbing fang</i> on autophagy of colonic cells and gut microbiota in ulcerative colitis of rats]."	"OBJECTIVE: To observe the effects of electroacupuncture (EA) at <i>changbing fang</i> (prescription for intestinal disease) on autophagy of colonic cells and gut microbiota in rats with ulcerative colitis (UC), and to explore the mechanism of EA in the treatment of UC. METHODS: Thirty-two SD male rats were randomly divided into a control group, a model group, an EA group and a sham-EA group, with 8 rats in each group. Except the control group, the UC rat model was established by free drinking of 5% dextran sulfate sodium solution for 7 days in the other groups. In the EA group, <i>changbing fang</i> was adopted, in which, EA was applied at ""Tianshu"" (ST25) and ""Shangjuxu"" (ST37), at disperse-dense wave and frequency of 10 Hz/50 Hz, for 20 min in each intervention. In the sham-EA group, shallow transcutaneous puncture was performed at the sites, 5 mm away from the points as the EA group, with the same parameters as the EA group. The intervention was delivered once daily for 3 consecutive days. The body weight was measured daily and the disease activity index (DAI) score was calculated before and after intervention. After intervention completion, the colon length was measured. Using HE staining, the colon morphology was observed and the score of colonic pathology was assessed. With ELISA adopted, the contents of tumor necrosis factor (TNF-α), interleukin (IL)-1β, IL-2 and IL-10 in the serum of the rats were detected. The ultrastructure of the colon tissue was observed under electron microscopy. Using Western blotting, the protein expression was detected for microtubule-associated protein 1 light chain 3 (LC3)Ⅱ, LC3Ⅰ, autophagy-related genes (ATG) 5, ATG12, sequestosome 1 (p62), phosphatidylinositol 3-kinase (PI3K), phosphorylated protein kinase B (p-AKT), protein kinase B (AKT), and phosphorylated mammalian target of rapamycin (p-mTOR), mammalian target of rapamycin (mTOR) in the colon tissue. The mRNA expression of PI3K, AKT and m-TOR in the colon tissue was detected by real-time fluorescence quantitative PCR. The 16S rRNA gene sequencing was used to analyze the structure of gut flora in the feces of rats. RESULTS: From day 1 to day 7, compared with the control group, the body weight decreased in the model group, EA group, and SEA group (<i>P</i><0.05, <i>P</i><0.01). From day 9 to day 10, the EA group showed an increase in body weight compared with the model group and SEA group (<i>P</i><0.05, <i>P</i><0.01). Before intervention, the DAI score in the model group, EA group, and SEA group was higher than the score of the control group, respectively (<i>P</i><0.01). After intervention, the DAI score in the EA group was reduced compared with the model group and SEA group (<i>P</i><0.01). Compared with the control group, in the model group, the colon length of rats was shorter (<i>P</i><0.01); it showed the distorted crypts, thinner mucosal layer, reduced goblet cells, inflammatory cell infiltration and the disarranged histological structure; and the pathological score of the colon tissue increased (<i>P</i><0.01); the serum contents of TNF-α and IL-1β increased (<i>P</i><0.01), and those of IL-2 and IL-10 decreased (<i>P</i><0.01). The structure of colon epithelial cells was disarranged, with cilia pelt off, and a large number of vacuoles in the cytoplasm; the mitochondria were swollen, with unclear structure and cristae partially disappeared; and few autophagosomes were observed. The value of LC3Ⅱ/LC3Ⅰand the protein expression of ATG5 and ATG12 in the colon tissues were reduced (<i>P</i><0.01), the protein expression of p62 and PI3K, and the values of p-AKT/AKT, and p-mTOR/mTOR increased (<i>P</i><0.01), and mRNA expression of PI3K, AKT and mTOR was elevated (<i>P</i><0.01). The indexes of Chao1, Ace and Shannon decreased (<i>P</i><0.01). At the phylum level, the relative abundance of <i>Firmicutes</i> decreased (<i>P</i><0.05), that of <i>Bacteroidetes</i> and <i>Proteobacteria</i> increased (<i>P</i><0.05, <i>P</i><0.01). At the genus level, the relevant abundance of <i>Lactobacillus</i> decreased (<i>P</i><0.05), while that of <i>Lachnospiraceae</i>_NK4A136_group and <i>Phascolarctobacterium</i> increased (<i>P</i><0.01, <i>P</i><0.05 ). Compared with the model group and SEA group, in the EA group, the colon length increased (<i>P</i><0.01), the infiltration of inflammatory cells was reduced, the arrangement of intestinal epithelial cells was arranged regularly, with a small amount of shedding, and the pathological score of the colon tissue decreased (<i>P</i><0.01). The serum contents of TNF-α and IL-1β decreased (<i>P</i><0.01), and those of IL-2 and IL-10 increased (<i>P</i><0.01). The colonic epithelial cells were arranged relatively, the morphology of organelles was basically normal, and autophagosomes were visible. The value of LC3Ⅱ/LC3Ⅰand the protein expression of ATG5 and ATG12 in colon tissue increased (<i>P</i><0.01, <i>P</i><0.05), the protein expression of p62 and PI3K, and the values of p-AKT/AKT, and p-mTOR/mTOR decreased (<i>P</i><0.01); and mRNA expression of PI3K, AKT, m-TOR was reduced (<i>P</i><0.01). The indexes of Chao1, Ace and Shannon increased (<i>P</i><0.01). At the phylum level, the relative abundance of <i>Firmicutes</i> increased (<i>P</i><0.01), while that of <i>Bacteroidetes</i> decreased (<i>P</i><0.01). At the genus level, the relative abundance of <i>Lactobacillus</i> increased (<i>P</i><0.05), whereas that of <i>Lachnospiraceae</i>_NK4A136_group decreased (<i>P</i><0.01). When compared with the model group, the relative abundance of <i>Proteobacteria</i> decreased (<i>P</i><0.05), and that of <i>Phascolarctobacterium</i> was reduced (<i>P</i><0.05) in the EA group. CONCLUSION: EA at <i>changbingfang</i> alleviates UC symptoms probably through inhibiting the PI3K/AKT/mTOR signaling pathway to regulate colonic autophagy and improve the intestinal flora."	"10.13703/j.0255-2930.20240912-k0003"	"English Abstract|Journal Article"	"Animals|Electroacupuncture|Colitis, Ulcerative|Male|Rats|Gastrointestinal Microbiome|Rats, Sprague-Dawley|Colon|Humans|Autophagy"
"A048"	"microbe_ibd"	"40407723"	"2025"	"Food & function"	"Reshaping the gut microbiota to ameliorate DSS-induced colitis using a novel synbiotic consisting of jujube powder and <i>Faecalibacterium prausnitzii</i>."	"Ulcerative colitis (UC) remains challenging to existing therapeutic approaches, which may have variable efficacy, side effects, and high relapse rates. Increasing evidence indicates the critical role of the gut microbiota in UC pathogenesis, making microbiota-targeted therapies promising for treatment. Here, we propose a novel synbiotic consisting of jujube powder and <i>Faecalibacterium prausnitzii</i> and confirm its effectiveness in ameliorating DSS-induced mouse colitis symptoms, including body weight loss, rectal bleeding, diarrhea, colon shortening, and histological damage. The synbiotic also enriched the diversity of the gut microbiota, in which anti-inflammatory microorganisms such as <i>Parasutterella</i> and <i>Parabacteroides</i> were increased while the potentially pathogenic and inflammation-associated microorganisms like <i>Clostridium_sensu_stricto_1</i> were suppressed. More importantly, the synbiotic helped to maintain immune homeostasis and inhibit the imbalance between Th1 and Th2 cells. The anti-inflammatory efficacy of the synbiotic was shown as a function of the ratio of jujube powder to <i>Faecalibacterium prausnitzii</i>. The aforementioned findings have shown the potential of this synbiotic in ameliorating colitis and are also helpful in deepening our understanding of the effects and mechanisms of the gut microbiota in UC therapy."	"10.1039/d4fo04815f"	"Journal Article"	"Gastrointestinal Microbiome|Animals|Ziziphus|Mice|Synbiotics|Faecalibacterium prausnitzii|Male|Dextran Sulfate|Powders|Colitis"
"A049"	"microbe_ibd"	"40761499"	"2025"	"Food & nutrition research"	"Anti-inflammatory effects of ethanolic extract from <i>Abeliophyllum distichum</i> (<i>Miseon</i> Tree) leaves in mice with dextran sulfate sodium-induced ulcerative colitis."	"<i>Abeliophyllum distichum</i> (Miseon tree), a native Korean plant, is known for the high phenolic content in its leaves. The ethanolic leaf extracts of <i>A. distichum</i> have shown antioxidant, anti-obesity, and anti-inflammatory properties. However, studies on its potential to improve colitis are limited. This study aimed to determine whether the ethanolic extract of <i>A. distichum</i> leaves (ADE) could alleviate dextran sulfate sodium (DSS)-induced colitis in mice. The mice were divided into three groups, and the experimental group was given 300 mg/kg ADE for 4 weeks. One week before the end of the experiment, 3% DSS was added to the drinking water to induce colitis. The clinical symptoms of colitis and damage to colon tissue, including the increase in <i>Enterobacteriaceae</i> abundance and a decrease in <i>Bifidobacterium</i> in the colon, were evaluated during DSS treatment. DSS overactivated the nuclear factor (NF)-κB signaling pathway, resulting in excessive production of pro-inflammatory cytokines. In contrast, ADE alleviated the DSS-induced colitis symptoms, protected against colonic tissue damage, and restored the balance of <i>Enterobacteriaceae</i> and <i>Bifidobacterium</i> levels in the colon. Moreover, ADE effectively inhibited the DSS-induced overactivation of the NF-κB signaling pathway within the colon and mitigated abnormal inflammatory responses. These findings suggest that ADE protects against colitis by modulating the growth of some intestinal strains and the NF-κB pathway in the colon, supporting its potential as a natural agent."	"10.29219/fnr.v69.11052"	"Journal Article"	""
"A050"	"microbe_ibd"	"40935302"	"2025"	"Acta biomaterialia"	"Dual-mechanism mucoadhesive hydrogel integrating pH-independent barriers and autophagy-driven immunotherapy for the treatment of ulcerative colitis."	"Current therapies for ulcerative colitis (UC) face critical challenges, including systemic toxicity and inadequate mucosal regeneration. Herein, we present a pioneering dual-mechanism therapeutic platform integrating pH-independent acid-treated sucralfate (ASF) with autophagy-inducing spermidine (Spd) to synergistically address UC pathogenesis. Unlike conventional pH-dependent barrier therapies, ASF forms a mechanically tunable, injectable hydrogel that adheres robustly to colonic mucosa regardless of local pH. Spermidine was easily mounted into ASF hydrogel matrix via electrostatic interaction, with more than 90 % encapsulation efficiency. Moreover, the mechanical strength of ASF hydrogel was precisely modulated by adjusting spermidine amount in formula, making it suitable for effective gut mucosa coverage. Importantly, in vitro permeability test showed that spermidine-loaded ASF hydrogel (Spd-ASF) demonstrated the selective barrier functionality, blocking > 80 % of Escherichia coli and LPS penetration while allowing nutrient permeability. Moreover, micro-CT images demonstrated that rectally infused Spd-ASF hydrogel was uniformly adhered to the colon wall at least for 8 h. In DSS-induced colitis mice, rectally administrating Spd-ASF hydrogel uniquely restored colon length to near-normal levels (vs. 30 % shortening in controls), reduced proinflammatory cytokines (TNF-α, IL-6, IL-1β) by 60-75 %, and doubled goblet cell density. Mechanistically, Spd-ASF reprogrammed macrophage behavior by activating autophagy and enhancing efferocytosis, driving M2 polarization to resolve inflammation. Notably, Spd-ASF uniquely reversed dysbiosis, elevating beneficial Lactobacillus while suppressing colitis-associated Muribaculaceae and Clostridia. This study is the first to combine mucoadhesive biomaterial engineering with autophagy-mediated immunomodulation, offering a paradigm shift in UC therapy by simultaneously shielding the mucosa and reprogramming inflammatory pathways. STATEMENT OF SIGNIFICANCE: Here, autophagy-inducing spermidine (Spd) and pH-independent acid-treated sucralfate (ASF) were combined to create the novel dual-mechanism hydrogel (Spd-ASF), which works in concert to combat UC pathogenesis. The selective barrier functioning of Spd-ASF hydrogel was established by its capacity to permit nutritional permeability while preventing the transfer of toxins (LPS) and pathogenic bacteria (E. coli). Additionally, rectally infused Spd-ASF hydrogel was consistently attached on the colon wall for at least eight hours, as seen by micro-CT images. Spd-ASF therapy doubled the density of goblet cells, decreased proinflammatory cytokines (TNF-α, IL-6, and IL-1β) by 60-75 %, boosted helpful Lactobacillus, and lowered pathogenic Muribaculaceae and Clostridia. It also restored colon length in DSS-induced colitis animals. Spd-ASF's therapeutic action was closely linked to promoting cellular efferocytosis and triggering macrophage autophagy."	"10.1016/j.actbio.2025.09.006"	"Journal Article"	"Animals|Colitis, Ulcerative|Autophagy|Hydrogels|Mice|Hydrogen-Ion Concentration|Immunotherapy|Humans|Intestinal Mucosa|Spermidine"
"A051"	"bioactive_ibd"	"27218415"	"2016"	"Molecular nutrition & food research"	"(-)-Epigallocatechin-3-gallate decreases colonic inflammation and permeability in a mouse model of colitis, but reduces macronutrient digestion and exacerbates weight loss."	"SCOPE: (-)-Epigallocatechin-3-gallate (EGCG) has been reported to have putative health effects including the prevention of inflammation and obesity. Historically, polyphenols have been regarded as antinutritionals and while such effects may be beneficial in obese subjects, they may be deleterious in nutritionally compromised individuals. METHODS AND RESULTS: We examined the effect of EGCG in the dextran sulfate sodium (DSS)-treated mouse model of ulcerative colitis. Following induction of colitis, mice were treated with EGCG (3.2 mg/g) as the sole source of drinking fluid for 3 days. EGCG treatment mitigated DSS-induced colon shortening and spleen enlargement. EGCG also decreased colonic protein levels of IL-1β, IL-6, and tumor necrosis factor-α, as well as colonic lipid peroxides compared to DSS-treated controls. We observed that EGCG reduced DSS-induced gastrointestinal permeability. These beneficial effects were offset by enhanced body weight loss in EGCG-treated mice compared to DSS-treated controls. These effects were related to decreased protein and lipid digestion in EGCG-treated mice compared to DSS-treated controls. CONCLUSIONS: Our results suggest that although EGCG may exert anti-inflammatory effects, its ability to modulate macronutrient digestion may represent a dose-limiting adverse effect that must be considered in the context of its use for treating inflammatory bowel disease."	"10.1002/mnfr.201501042"	"Journal Article|Research Support, Non-U.S. Gov't|Research Support, N.I.H., Extramural|Research Support, U.S. Gov't, Non-P.H.S."	"Animals|Biomarkers|Caco-2 Cells|Catechin|Chemokine CCL2|Colitis, Ulcerative|Dextran Sulfate|Digestion|Disease Models, Animal|Humans"
"A052"	"bioactive_ibd"	"28282584"	"2017"	"The Journal of nutritional biochemistry"	"Pomegranate polyphenolics reduce inflammation and ulceration in intestinal colitis-involvement of the miR-145/p70S6K1/HIF1α axis in vivo and in vitro."	"This study investigated the potential role of the p70S6K1/HIF1α axis in the anti-inflammatory activities of pomegranate (Punica granatum L.) polyphenolics in dextran sodium sulfate (DSS)-induced colitis in Sprague-Dawley rats and in lipopolysaccharide (LPS)-treated CCD-18Co colon-myofibroblastic cells. Rats were administered either control (CT) or pomegranate beverage (PG), containing ellagic acid and ellagitannins, then exposed to three cycles of 3% DSS followed by a 2-week recovery period. PG protected against DSS-induced colon inflammation and ulceration (50% and 66.7%, P=.05 and .045, respectively), and decreased the Ki-67 proliferative index in the central and basal regions compared to the control. PG also significantly reduced the expression of proinflammatory cytokines (TNF-α and IL-1β), COX-2, and iNOS at mRNA and protein levels. In addition, the expression of p70S6K1 and HIF1α was reduced, while the tumor suppressor miR-145 was induced by PG. The intestinal microbiota of rats treated with PG showed a significant increase in Ruminococcaceae that include several butyrate producing bacteria (P=.03). In vitro, PG reduced the expression of p70S6K1 and HIF1α and induced miR-145 in a dose-dependent manner. The involvement of miR-145/p70S6K1 was confirmed by treating LPS-treated CCD-18Co cells with miR-145 antagomiR, where the pomegranate polyphenolics reversed the effects of the antagomiR for p70S6K1 mRNA and protein levels. These results suggest that pomegranate polyphenols attenuated DSS-induced colitis by modulating the miR-145/p70S6K/HIF1α axis, indicating potential use in therapeutic treatment of ulcerative colitis."	"10.1016/j.jnutbio.2017.02.005"	"Journal Article"	"Animals|Anti-Inflammatory Agents, Non-Steroidal|Cell Line|Cell Proliferation|Colitis, Ulcerative|Dextran Sulfate|Fruit and Vegetable Juices|Gastrointestinal Microbiome|Humans|Hypoxia-Inducible Factor 1, alpha Subunit"
"A053"	"bioactive_ibd"	"28637899"	"2017"	"Journal of immunology (Baltimore, Md. : 1950)"	"Dietary Salt Exacerbates Experimental Colitis."	"The Western diet is characterized by high protein, sugar, fat, and low fiber intake, and is widely believed to contribute to the incidence and pathogenesis of inflammatory bowel disease (IBD). However, high sodium chloride salt content, a defining feature of processed foods, has not been considered as a possible environmental factor that might drive IBD. We set out to bridge this gap. We examined murine models of colitis on either a high salt diet (HSD) or a low salt diet. We demonstrate that an HSD exacerbates inflammatory pathology in the IL-10-deficient murine model of colitis relative to mice fed a low salt diet. This was correlated with enhanced expression of numerous proinflammatory cytokines. Surprisingly, sodium accumulated in the colons of mice on an HSD, suggesting a direct effect of salt within the colon. Similar to the IL-10-deficient model, an HSD also enhanced cytokine expression during infection by <i>Salmonella typhimurium</i> This occurred in the first 3 d of infection, suggesting that an HSD potentiates an innate immune response. Indeed, in cultured dendritic cells we found that high salt media potentiates cytokine expression downstream of TLR4 activation via p38 MAPK and SGK1. A third common colitis model, administration of dextran sodium sulfate, was hopelessly confounded by the high sodium content of the dextran sodium sulfate. Our results raise the possibility that high dietary salt is an environmental factor that drives increased inflammation in IBD."	"10.4049/jimmunol.1700356"	"Journal Article"	"Animals|Colitis|Colon|Culture Media|Cytokines|Dendritic Cells|Dextran Sulfate|Disease Models, Animal|Disease Progression|Immediate-Early Proteins"
"A054"	"bioactive_ibd"	"32014479"	"2020"	"International journal of biological macromolecules"	"The α-D-glucan from marine fungus Phoma herbarum YS4108 ameliorated mice colitis by repairing mucosal barrier and maintaining intestinal homeostasis."	"Ulcerative colitis (UC) is a chronic inflammatory bowel disease of unknown etiology with increasing incidence world widely. Previous studies have indicated that the α-D-glucan YCP purified from the mycelium of the marine fungus Phoma herbarum YS4108 had certain immunomodulatory activities in animal and cell models. In the study, the therapeutic effect and intestinal regulatory activity of YCP (40 mg/kg, intraperitoneal injection) on UC were investigated in dextran sulfate sodium (DSS)-induced colitis mice. The results showed YCP could improve the general symptoms, reestablish the intestinal immune balance, and repair the mucosal barrier in colitis mice. The administration of YCP also significantly increased butyrate and isovaleric acid levels. In addition, YCP resulted in prominent alterations on specific microbiota including Firmicutes, Bacteroidetes, Proteobacteria, Clostridiales, and Lachnospiraceae which are closely related to immune regulation and mucus repair. Therefore, YCP may be a candidate for curing UC because of its conspicuous effects comparable to 5-aminosalicylic acid (5-ASA)."	"10.1016/j.ijbiomac.2020.01.303"	"Journal Article"	"Animals|Aquatic Organisms|Ascomycota|Colitis|Cytokines|Fatty Acids|Feces|Gastrointestinal Microbiome|Glucans|Homeostasis"
"A055"	"bioactive_ibd"	"32726162"	"2020"	"American journal of physiology. Gastrointestinal and liver physiology"	"A murine model of pediatric inflammatory bowel disease causes microbiota-gut-brain axis deficits in adulthood."	"Inflammatory bowel diseases (IBDs) are chronic intestinal diseases, frequently associated with comorbid psychological and cognitive deficits. These neuropsychiatric effects include anxiety, depression, and memory impairments that can be seen both during active disease and following remission and are more frequently seen in pediatric patients. The mechanism(s) through which these extraintestinal deficits develop remain unknown, and the study of these phenomenon is hampered by a lack of murine pediatric IBD models. Herein we describe microbiota-gut-brain (MGB) axis deficits following induction of colitis in a pediatric setting. Acute colitis was induced by administration of 2% dextran sodium sulfate (DSS) for 5 days starting at weaning [postnatal day (P)21] causing reduced weight gain, colonic shortening, and colonic inflammation by 8 days post-DSS (P29), which were mostly resolved in adult (P56) mice. Despite resolution of acute disease, cognitive deficits (novel object recognition task) and anxiety-like behavior (light/dark box) were identified in the absence of changes in exploratory behavior (open field test) in P56 mice previously treated with DSS at weaning. Behavioral deficits were found in conjunction with neuroinflammation, decreased neurogenesis, and altered expression of pattern recognition receptor genes in the hippocampus. Additionally, persistent alterations in the gut microbiota composition were observed at P56, including reduced butyrate-producing species. Taken together, these results describe for the first time the presence of MGB axis deficits following induction of colitis at weaning, which persist in adulthood.<b>NEW & NOTEWORTHY</b> Here we describe long-lasting impacts on the microbiota-gut-brain (MGB) axis following administration of low-dose dextran sodium sulfate (DSS) to weaning mice (P21), including gut dysbiosis, colonic inflammation, and brain/behavioral deficits in adulthood (P56). Early-life DSS leads to acute colonic inflammation, similar to adult mice; however, it results in long-lasting deficits in the MGB axis in adulthood (P56), in contrast to the transient deficits seen in adult DSS. This model highlights the unique features of pediatric inflammatory bowel disease."	"10.1152/ajpgi.00177.2020"	"Journal Article|Research Support, N.I.H., Extramural|Research Support, Non-U.S. Gov't"	"Animals|Anxiety|Behavior, Animal|Brain|Cognition Disorders|Colitis|Dextran Sulfate|Disease Models, Animal|Dysbiosis|Female"
"A056"	"bioactive_ibd"	"32856645"	"2020"	"Food & function"	"Flaxseed oligosaccharides alleviate DSS-induced colitis through modulation of gut microbiota and repair of the intestinal barrier in mice."	"Intestinal epithelial barrier dysfunction with dysbiosis of gut microbiota contributes to the occurrence and acceleration of colitis. This study aimed to evaluate the effect of flaxseed oligosaccharides (FOSs) on dextran sulfate sodium (DSS)-induced ulcerative colitis (UC) mice and to elucidate the underlying mechanisms. UC was induced in mice by administering 2% DSS in drinking water for 8 days. Then, FOS (50 mg kg-1 d-1, 100 mg kg-1 d-1 and 200 mg kg-1 d-1) was administered by gavage for 14 days. The results showed that FOS treatment (200 mg kg-1 d-1) significantly ameliorated colitis by decreasing disease activity index (DAI), increasing colon length and improving colonic histology. FOS treatment (200 mg kg-1 d-1) down-regulated the critical markers of oxidative stresses, including malondialdehyde (MDA) and myeloperoxidase (MPO). Furthermore, FOS (200 mg kg-1 d-1) significantly suppressed the levels of pro-inflammatory cytokines including tumor necrosis factor (TNF)-α, interleukin (IL)-6 and interleukin (IL)-1β but increased that of anti-inflammatory cytokine interleukin (IL)-10. The 16S rDNA gene high-throughput sequencing results indicated that FOS treatment increased the gut microbial diversity and inhibited the proliferation of inflammation-related bacteria such as unidentified_Clostridiales. An increase in total short-chain fatty acids (SCFAs), propionic acid and butyric acid, was also observed by FOS supplementation. FOS (200 mg kg-1d-1) also protected the intestinal barrier by increasing the protein levels of Claudin1 and Occludin. In conclusion, FOS attenuated DSS-induced colitis by modulating the gut microbiota and repairing the intestinal barrier."	"10.1039/d0fo01105c"	"Journal Article"	"Animals|Bacteria|Colitis, Ulcerative|Dextran Sulfate|Flax|Gastrointestinal Microbiome|Humans|Interleukin-1beta|Interleukin-6|Intestinal Mucosa"
