"annot_id"	"stratum"	"pmid"	"year"	"journal"	"title"	"abstract"	"doi"	"publication_types"	"mesh_terms"
"A070"	"bioactive_ibd"	"41987447"	"2026"	"Zhongguo zhen jiu = Chinese acupuncture & moxibustion"	"[Mechanism of moxibustion on intestinal fibrosis in Crohn's disease based on Trp/Kyn/AhR pathways in mice]."	"OBJECTIVE: To observe the effect of moxibustion on tryptophan (Trp)/kynurenine (Kyn)/aryl hydrocarbon receptor (AhR) pathway in the colon of mice with intestinal fibrosis of Crohn's disease (CD), and explore the mechanism of moxibustion on CD intestinal inflammation and intestinal fibrosis. METHODS: Among 28 male SPF C57BL/6 mice, 8 mice were randomly selected as the normal group, and CD intestinal fibrosis models were prepared by enema with 5% trinitro-benzene sulfonic acid (TNBS) in the remaining mice as the modeling group. Eighteen successfully modeled mice were randomly divided into a model group, a western medication group, and a moxibustion group, 6 mice in each one. In the moxibustion group, mild moxibustion was operated at ""Qihai"" (CV6) and bilateral ""Tianshu"" (ST25), once daily, 10 min each time and for consecutive 7 days. In the western medication group, the gavage with mesalazine enteric-coated tablet suspension, 0.5 mL was administered, once a day and for consecutive 7 days. The general condition, score of disease activity index (DAI), colon length, and colonic macroscopic score were observed in each group. HE and Masson staining were used to examine the morphology of the colon and intestinal fibrosis in mice, and the collagen volume fraction (CVF) was calculated. ELISA was adopted to detect the contents of interleukin (IL)-12, IL-23, Trp and Kyn in colon tissue. Using immunofluorescence assay, the positive expression of Collagen Ⅰ, Collagen Ⅲ and indolamine 2,3-dioxygenase (IDO) was observed. Using Western blot method, the protein expression of Collagen Ⅰ, Collagen Ⅲ, IDO and AhR in colon was detected. Using real-time quantitative PCR, the mRNA expression of IDO and AhR in colon was detected. RESULTS: Compared with the normal group, in the model group, the body mass was reduced and the colon length shortened (<i>P</i><0.01), DAI score, the gross macroscopic score and histological score of colon increased (<i>P</i><0.01), CVF was higher (<i>P</i><0.01), the contents of IL-12, IL-23, Trp and Kyn and the ratio of Kyn to Trp were elevated (<i>P</i><0.01), the protein expression of Collagen Ⅰ and Collagen Ⅲ increased (<i>P</i><0.01), and the protein and mRNA expression of IDO and AhR were higher (<i>P</i><0.01). When compared with the model group, in the moxibustion group and the western medication group, the colon length was increased (<i>P</i><0.01), DAI score, the gross macroscopic score and histological score of colon were reduced (<i>P</i><0.05<i>, P</i><0.01), CVF was lower (<i>P</i><0.01), the contents of IL-12, IL-23, Trp and Kyn and the ratio of Kyn to Trp were reduced (<i>P</i><0.01, <i>P</i><0.05), the protein expression of Collagen Ⅰ and Collagen Ⅲ decreased (<i>P</i><0.05), the protein and mRNA expression of IDO and AhR was declined (<i>P</i><0.01, <i>P</i><0.05). In comparison with the moxibustion group, the contents of Trp and Kyn in the colon were lower in the western medication group (<i>P</i><0.01). CONCLUSION: Moxibustion can attenuate intestinal inflammation and fibrosis induced by TNBS in CD mice, and its mechanism may be related to regulating Trp/Kyn/AhR pathway."	"10.13703/j.0255-2930.20241209-k0003"	"English Abstract|Journal Article"	"Animals|Moxibustion|Male|Mice|Crohn Disease|Mice, Inbred C57BL|Fibrosis|Receptors, Aryl Hydrocarbon|Humans|Kynurenine"
"A071"	"off_scope"	"27612488"	"2018"	"Gut"	"Real-life chromoendoscopy for neoplasia detection and characterisation in long-standing IBD."	"OBJECTIVE: Outside clinical trials, the effectiveness of chromoendoscopy (CE) for long-standing IBD surveillance is controversial. We aimed to assess the effectiveness of CE for neoplasia detection and characterisation, in real-life. DESIGN: From June 2012 to 2014, patients with IBD were prospectively included in a multicentre cohort study. Each colonic segment was evaluated with white light followed by 0.4% indigo carmine CE. Specific lesions' features were recorded. Optical diagnosis was assessed. Dysplasia detection rate between expert and non-expert endoscopists and learning curve were ascertained. RESULTS: Ninety-four (15.7%) dysplastic (1 cancer, 5 high-grade dysplasia, 88 low-grade dysplasia) and 503 (84.3%) non-dysplastic lesions were detected in 350 patients (47% female; mean disease duration: 17 years). Colonoscopies were performed with standard definition (41.5%) or high definition (58.5%). Dysplasia miss rate with white light was 40/94 (57.4% incremental yield for CE). CE-incremental detection yield for dysplasia was comparable between standard definition and high definition (51.5% vs 52.3%, p=0.30). Dysplasia detection rate was comparable between expert and non-expert (18.5% vs 13.1%, p=0.20). No significant learning curve was observed (8.2% vs 14.2%, p=0.46). Sensitivity, specificity, and positive and negative predictive values for dysplasia optical diagnosis were 70%, 90%, 58% and 94%, respectively. Endoscopic characteristics predictive of dysplasia were: proximal location, loss of innominate lines, polypoid morphology and Kudo pit pattern III-V. CONCLUSIONS: CE presents a high diagnostic yield for neoplasia detection, irrespectively of the technology and experience available in any centre. In vivo, CE optical diagnosis is highly accurate for ruling out dysplasia, especially in expert hands. Lesion characteristics can aid the endoscopist for in situ therapeutic decisions. TRIAL REGISTRATION NUMBER: NCT02543762."	"10.1136/gutjnl-2016-312332"	"Clinical Trial|Journal Article|Multicenter Study|Research Support, Non-U.S. Gov't"	"Adult|Aged|Clinical Competence|Colitis, Ulcerative|Colonoscopy|Colorectal Neoplasms|Coloring Agents|Crohn Disease|Early Detection of Cancer|Education, Medical, Continuing"
"A072"	"off_scope"	"30714145"	"2019"	"British journal of pharmacology"	"Inhibition of Ca<sub>v</sub> 3.2 calcium channels: A new target for colonic hypersensitivity associated with low-grade inflammation."	"BACKGROUND AND PURPOSE: Abdominal pain associated with low-grade inflammation is frequently encountered in irritable bowel syndrome (IBS) and inflammatory bowel disease (IBD) during remission. Current treatments are not very effective and new therapeutic approaches are needed. The role of Ca<sub>V</sub> 3.2 channels, which are important in other chronic pain contexts, was investigated in a murine model of colonic hypersensitivity (CHS) associated with low-grade inflammation. EXPERIMENTAL APPROACH: Low doses of dextran sulfate sodium (DSS; 0.5%) were chronically administered to C57BL/6j mice in drinking water. Their inflammatory state was assessed by systemic and local measures of IL-6, myeloperoxidase, and lipocalin-2 using elisa. Colonic sensitivity was evaluated by the visceromotor responses to colorectal distension. Functional involvement of Ca<sub>V</sub> 3.2 channels was assessed with different pharmacological (TTA-A2, ABT-639, and ethosuximide) and genetic tools. KEY RESULTS: DSS induced low-grade inflammation associated with CHS in mice. Genetic or pharmacological inhibition of Ca<sub>V</sub> 3.2 channels reduced CHS. Cav3.2 channel deletion in primary nociceptive neurons in dorsal root ganglia (Ca<sub>V</sub> 3.2<sup>Nav1.8</sup> KO mice) suppressed CHS. Spinal, but not systemic, administration of ABT-639, a peripherally acting T-type channel blocker, reduced CHS. ABT-639 given intrathecally to Ca<sub>V</sub> 3.2<sup>Nav1.8</sup> KO mice had no effect, demonstrating involvement of Ca<sub>V</sub> 3.2 channels located presynaptically in afferent fibre terminals. Finally, ethosuximide, which is a T-type channel blocker used clinically, reduced CHS. CONCLUSIONS AND IMPLICATIONS: These results suggest that ethosuximide represents a promising drug reposition strategy and that inhibition of Ca<sub>V</sub> 3.2 channels is an attractive therapeutic approach for relieving CHS in IBS or IBD."	"10.1111/bph.14608"	"Journal Article|Research Support, Non-U.S. Gov't"	"Animals|Benzeneacetamides|Calcium Channel Blockers|Calcium Channels, T-Type|Colon|Dextran Sulfate|Disease Models, Animal|Ethosuximide|Ganglia, Spinal|Heterocyclic Compounds, 2-Ring"
"A073"	"off_scope"	"32232483"	"2020"	"Blood"	"An intestinal organoid-based platform that recreates susceptibility to T-cell-mediated tissue injury."	"A goal in precision medicine is to use patient-derived material to predict disease course and intervention outcomes. Here, we use mechanistic observations in a preclinical animal model to design an ex vivo platform that recreates genetic susceptibility to T-cell-mediated damage. Intestinal graft-versus-host disease (GVHD) is a life-threatening complication of allogeneic hematopoietic cell transplantation. We found that intestinal GVHD in mice deficient in Atg16L1, an autophagy gene that is polymorphic in humans, is reversed by inhibiting necroptosis. We further show that cocultured allogeneic T cells kill Atg16L1-mutant intestinal organoids from mice, which was associated with an aberrant epithelial interferon signature. Using this information, we demonstrate that pharmacologically inhibiting necroptosis or interferon signaling protects human organoids derived from individuals harboring a common ATG16L1 variant from allogeneic T-cell attack. Our study provides a roadmap for applying findings in animal models to individualized therapy that targets affected tissues."	"10.1182/blood.2019004116"	"Journal Article|Research Support, N.I.H., Extramural|Research Support, Non-U.S. Gov't"	"Acrylamides|Animals|Autophagy|Autophagy-Related Proteins|Bone Marrow Transplantation|Coculture Techniques|Colon|Female|Genetic Predisposition to Disease|Graft vs Host Disease"
"A074"	"off_scope"	"37523538"	"2023"	"Proceedings of the National Academy of Sciences of the United States of America"	"Engineered calprotectin-sensing probiotics for IBD surveillance in humans."	"Inflammatory bowel disease (IBD) is a spectrum of autoimmune diseases affecting the gastrointestinal tract characterized by a relapsing and remitting course of gut mucosal inflammation. Disease flares can be difficult to predict, and the current practice of IBD disease activity surveillance through endoscopy is invasive and requires medical expertise. Recent advancements in synthetic biology raise the possibility that symbiotic microbes can be engineered to selectively detect disease biomarkers used in current clinical practice. Here, we introduce an engineered probiotic capable of detecting the clinical gold standard IBD biomarker, calprotectin, with sensitivity and specificity in IBD patients. Specifically, we identified a bacterial promoter in the probiotic strain <i>Escherichia coli</i> Nissle 1917 (EcN) which exhibits a specific expression increase in the presence of calprotectin. Using murine models of colitis, we show that the reporter signal is activated in vivo during transit of the GI tract following oral delivery. Furthermore, our engineered probiotic can successfully discriminate human patients with active IBD from those in remission and without IBD using patient stool samples, where the intensity of reporter signal quantitatively tracks with clinical laboratory-measured levels of calprotectin. Our pilot study sets the stage for probiotics that can be engineered to detect fecal calprotectin for precise noninvasive disease activity monitoring in IBD patients."	"10.1073/pnas.2221121120"	"Journal Article|Research Support, N.I.H., Extramural|Research Support, U.S. Gov't, Non-P.H.S.|Research Support, Non-U.S. Gov't"	"Humans|Animals|Mice|Leukocyte L1 Antigen Complex|Pilot Projects|Inflammatory Bowel Diseases|Sensitivity and Specificity|Colitis|Feces|Biomarkers"
"A075"	"off_scope"	"38458342"	"2024"	"Journal of ethnopharmacology"	"Chemopreventive and immunomodulatory effects of phenolic-rich extract of Commiphora leptophloeos against inflammatory bowel disease: Preclinical evidence."	"ETHNOPHARMACOLOGY RELEVANCE: Commiphora leptophloeos (Mart.) J.B. Gillet (Burseraceae) is a medicinal plant native to Brazil, popularly known as ""imburana"". Homemade leaf decoction and maceration were used to treat general inflammatory problems in the Brazilian Northeast population. Our previous research confirmed the anti-inflammatory activity of the C. leptophloeos hydroalcoholic leaf extract. AIM OF THE STUDY: Inflammatory bowel disease (IBD) is a chronic and relapsing inflammatory disorder of the gut with no ideal treatment to maintain the remissive status. This work aimed to characterize the phytochemical composition and physicochemical properties of the C. leptophloeos hydroalcoholic leaf extract and its efficacy in chemopreventive and immunomodulatory responses in inflammatory bowel disease in non-clinical models. MATERIALS AND METHODS: Mass spectrometry and physicochemical tests determined the phytochemical profile and physicochemical characteristics of the Commiphora leptophloeos (CL) extract. The chemopreventive and immunomodulatory effects of CL extract (50 and 125 μg/mL) were evaluated in vitro in the RAW 264.7 lipopolysaccharide (LPS) induced cell assay and in vivo in the model of intestinal inflammation induced by 2,4-Dinitrobenzenesulfonic acid (DNBS) in mice when they were treated with CL extract by intragastric gavage (i.g.) at doses of 300, 400 and 500 mg/kg. RESULTS: Phytochemical annotation of CL extract showed a complex phenolic composition, characterized as phenolic acids and flavonoids, and satisfactory physicochemical characteristics. In addition, CL extract maintained the viability of RAW macrophages, reduced ROS and NO production, and negatively regulated COX-2, iNOS, TNF-α, IL-1β, IL-6, and IL-17 (p < 0.05). In the intestinal inflammation model, CL extract was able to downregulate NF-κB p65/COX-2, mTOR, iNOS, IL-17, decrease levels of malondialdehyde and myeloperoxidase and cytokines TNF-α, IL-1β and IL-6 (p < 0.05). CONCLUSION: Based on these findings, CL extract reduced inflammatory responses by down-regulating pro-inflammatory markers in macrophages induced by LPS and DNBS-induced colitis in mice through NF-κB p65/COX-2 signaling. CL leaf extract requires further investigation as a candidate for treating inflammatory bowel disease."	"10.1016/j.jep.2024.118025"	"Journal Article"	"Mice|Animals|Plant Extracts|Commiphora|Interleukin-17|Tumor Necrosis Factor-alpha|NF-kappa B|Interleukin-6|Lipopolysaccharides|Cyclooxygenase 2"
"A076"	"off_scope"	"39032536"	"2024"	"European journal of pharmaceutical sciences : official journal of the European Federation for Pharmaceutical Sciences"	"ROS-responsive thioketal nanoparticles delivering system for targeted ulcerative colitis therapy with potent HDAC6 inhibitor, tubastatin A."	"Ulcerative colitis (UC) is a common gastrointestinal problem characterized by the mucosal injury primarily affecting the large intestine. Currently available therapies are not satisfactory as evidenced by high relapse rate and adverse effects. In this study we aimed to develop an effective drug delivery system using reactive oxygen species (ROS)-responsive thioketal nanoparticles (TKNP), to deliver tubastatin A, a potent HDAC6 inhibitor, to the inflamed colon in mice with ulcerative colitis (UC). TKNPs were synthesized by step-growth polymerization from an acetal exchange reaction while TUBA-TKNP was prepared using the single emulsion solvent evaporation technique. Our developed nanoparticle showed release of tubastatin A only in presence of ROS which is found to be highly present at the site of inflamed colon. Oral administration of TUBA-TKNP resulted in the higher accumulation of tubastatin A at the inflamed colon site and decreased the inflammation as evidenced by reduced infiltration of immune cells and decreased level of pro-inflammatory cytokines in TUBA-TKNP treated mice. In summary, our results show the successful localization of tubastatin A at the site of colon inflammation through TUBA-TKNP delivery, as well as resolution of clinical features of UC in mice."	"10.1016/j.ejps.2024.106856"	"Journal Article"	"Animals|Colitis, Ulcerative|Histone Deacetylase 6|Reactive Oxygen Species|Histone Deacetylase Inhibitors|Hydroxamic Acids|Mice|Nanoparticles|Indoles|Colon"
"A077"	"off_scope"	"39200891"	"2024"	"Journal of clinical medicine"	"Insights into Probiotic Prescription among Gastroenterologists and Other Healthcare Professionals: Evidence from an Italian Survey."	"<b>Background</b>: Probiotics, which are live microorganisms that provide health benefits, have been extensively studied for their various clinical applications. However, despite their potential, high-quality data supporting their use in several gastrointestinal diseases are often lacking, and prescription behaviors can widely differ. This study aimed to assess different behaviors in probiotics knowledge and prescriptions among Italian gastroenterologists and healthcare professionals (HPs). <b>Methods</b>: A web-based electronic survey was distributed to all participants at the National Meeting of the Italian Young Gastroenterologist and Endoscopist Association (AGGEI) held in 2023. The survey investigated probiotic prescription practices for several gastrointestinal conditions, such as acute diarrhea, irritable bowel syndrome, inflammatory bowel disease, and diverticular disease. <b>Results</b>: Among 200 participants, 142 completed the survey, of whom 59 were gastroenterologists and 83 were HPs (surgeons, nutrition biologists, and other physicians). Significant differences were observed in the prescription of probiotics for the treatment of acute diarrhea and <i>H. pylori</i>. Both groups prescribed probiotics in monthly cycles for patients with IBS, although the majority prescribed multistrain formulations. Gastroenterologists were more likely to prescribe cyclic courses for IBS, while HPs tended to continue therapy by changing the probiotic strain in case of inefficacy. For ulcerative colitis, gastroenterologists prescribed probiotics more but for shorter durations. In Crohn's disease, gastroenterologists prescribed probiotics less and were less likely to prescribe multistrain formulations. Regarding SUDD, gastroenterologists tended to prescribe probiotics less frequently, although without a significant difference, with similar rates of preference for multistrain formulations. <b>Conclusions</b>: This survey highlights heterogeneous behaviors in probiotic prescription between gastroenterologists and HPs, with gastroenterologists more aligned with guidelines and available scientific evidence. Hence, enhancing probiotic education among healthcare professionals and gastroenterologists is crucial. Further studies are needed to better understand probiotics' role in gastrointestinal disorders through large-scale randomized controlled trials."	"10.3390/jcm13164749"	"Journal Article"	""
"A078"	"off_scope"	"39569890"	"2025"	"Clinical and translational gastroenterology"	"Development of Time-Aggregated Machine Learning Model for Relapse Prediction in Pediatric Crohn's Disease."	"INTRODUCTION: Pediatric Crohn's disease (CD) easily progresses to an active disease compared with adult CD, making it important to predict and minimize CD relapses. However, prediction of relapse at various time points (TPs) during pediatric CD remains understudied. We aimed to develop a real-time aggregated model to predict pediatric CD relapse in different TPs and time windows (TWs). METHODS: This retrospective study was conducted on children diagnosed with CD between 2015 and 2022 at Severance Hospital. Laboratory test results and demographic data were collected starting at 3 months after diagnosis, and cohorts were formed using data from 6 different TPs at 1-month intervals. Relapse-defined as a pediatric CD activity index ≥ 30 points-was predicted, and TWs were 3-7 months with 1-month intervals. The feature importance of the variables in each setting was determined. RESULTS: Data from 180 patients were used to construct cohorts corresponding to the TPs. We identified the optimal TP and TW to reliably predict pediatric CD relapse with an area under the receiver operating characteristic curve score of 0.89 when predicting with a 3-month TW at a 3-month TP. Variables such as C-reactive protein levels and lymphocyte fraction were found to be important factors. DISCUSSION: We developed a time-aggregated model to predict pediatric CD relapse in multiple TPs and TWs. This model identified important variables that predicted relapse in pediatric CD to support real-time clinical decision making."	"10.14309/ctg.0000000000000794"	"Journal Article"	"Humans|Crohn Disease|Male|Retrospective Studies|Female|Machine Learning|Recurrence|Child|Adolescent|Time Factors"
"A079"	"off_scope"	"39825768"	"2025"	"United European gastroenterology journal"	"Inter-Rater Disagreements in Applying the Montreal Classification for Crohn's Disease: The Five-Nations Survey Study."	"BACKGROUND: The Montreal classification has been widely used in Crohn's disease since 2005 to categorize patients by the age of onset (A), disease location (L), behavior (B), and upper gastrointestinal tract and perianal involvement. With evolving management paradigms in Crohn's disease, we aimed to assess the performance of gastroenterologists in applying the Montreal classification. METHODS: An online survey was conducted among participants at an international educational conference on inflammatory bowel diseases. Participants classified 20 theoretical Crohn's disease cases using the Montreal classification. Agreement rates with the inflammatory bowel diseases board (three expert gastroenterologists whose consensus rating was considered the gold standard) were calculated for gastroenterologist specialists and fellows/specialists with ≤ 2 years of clinical experience. A majority vote < 75% among participants was considered a notable disagreement. The same cases were classified using three large language models (LLMs), ChatGPT-4, Claude-3, and Gemini-1.5, and assessed for agreement with the board and gastroenterologists. Fleiss Kappa was used to assess within-group agreement. RESULTS: Thirty-eight participants from five countries completed the survey. In defining the Montreal classification as a whole, specialists (21/38 [55%]) had a higher agreement rate with the board compared to fellows/young specialists (17/38 [45%]) (58% vs. 49%, p = 0.012) and to LLMs (58% vs. 18%, p < 0.001). Disease behavior classification was the most challenging, with 76% agreement among specialists and fellows/young specialists and 48% among LLMs compared to the inflammatory bowel diseases board. Regarding disease behavior, within-group agreement was moderate (specialists: k = 0.522, fellows/young specialists: k = 0.532, LLMs: k = 0.577; p < 0.001 for all). Notable points of disagreement included: defining disease behavior concerning obstructive symptoms, assessing disease extent via video capsule endoscopy, and evaluating treatment-related reversibility of the disease phenotype. CONCLUSIONS: There is significant inter-rater disagreement in applying the Montreal classification, particularly for disease behavior in Crohn's disease. Improved education or revisions to phenotype criteria may be needed to enhance consensus on the Montreal classification."	"10.1002/ueg2.12757"	"Journal Article"	"Humans|Crohn Disease|Consensus|Surveys and Questionnaires|Gastroenterologists|Observer Variation|Gastroenterology|Female|Male|Severity of Illness Index"
"A080"	"off_scope"	"40263925"	"2025"	"Small (Weinheim an der Bergstrasse, Germany)"	"Broad-Spectrum ROS/RNS Scavenging Catalase-Loaded Microreactors for Effective Oral Treatment of Inflammatory Bowel Diseases."	"Inflammatory bowel disease (IBD) such as ulcerative colitis (UC) is an autoimmune disease characterized by persistent inflammation along the gastrointestinal tract with excessive generation of reactive oxygen species (ROS)/reactive nitrogen species (RNS) generation. Here, catalase (CAT)-containing microreactor capsules with long-lasting broad-spectrum ROS/RNS-scavenging capability are developed for the treatment of IBD. In this design, CAT is encapsulated in the dense hydrogel network of calcium alginate (ALG) microspheres, which provides long-term protection of CAT activity in protease-rich intestinal environment. Afterward, the polydopamine (PDA) modification on the surface of CAT@ALG microspheres can provide them bioadhesiveness to achieve prolonged retention in the intestinal tract and broad-spectrum scavenging capability against various types of ROS/RNS beyond hydrogen peroxide. Enteric capsules are further used to protect the CAT@ALG-PDA microspheres from gastric fluid for selective release at the intestinal site. The combined action of PDA and CAT in CAT@ALG-PDA microreactors results in the broad-spectrum scavenging of excess ROS/RNS and regulates redox balance in acute UC rat model, showing satisfactory therapeutic effects superior to the mesalazine and adalimumab at clinically relevant doses without obvious side effects. This work highlights that these CAT@ALG-PDA capsules can act as long-acting broad-spectrum ROS/RNS reactors, promising for IBD treatment."	"10.1002/smll.202501341"	"Journal Article"	"Catalase|Animals|Reactive Oxygen Species|Inflammatory Bowel Diseases|Microspheres|Reactive Nitrogen Species|Administration, Oral|Rats|Alginates|Capsules"
